{
  "appId": "radare2",
  "version": "1.0.0",
  "notes": "Radare2 simulation requires FEATURE_TOOL_APIS to be enabled.",
  "endpoints": [
    {
      "method": "POST",
      "path": "/api/radare2",
      "description": "Runs Radare2 analysis utilities.",
      "mock": {
        "status": 501,
        "body": {
          "error": "Not implemented"
        }
      },
      "runtimeTest": {
        "enabled": true,
        "expectedStatus": 501,
        "responseSchema": {
          "type": "object",
          "required": [
            "error"
          ],
          "properties": {
            "error": {
              "type": "string"
            }
          },
          "additionalProperties": true
        }
      }
    }
  ]
}
